{
  "title": "Dungeonbreak",
  "$schema": "https://dungeonbreak.dev/schemas/world-map.schema.json",
  "regions": [
    {
      "kind": "hub",
      "name": "Emberfall",
      "tags": [
        "surface",
        "ashlands",
        "dungeonbreak"
      ],
      "town": {
        "name": "Emberfall Town",
        "exits": [],
        "placeId": "emberfall-town",
        "description": "Central settlement of the region."
      },
      "rules": {
        "usesRooms": false,
        "isSafeZone": false,
        "usesBuildings": true,
        "supportsFastTravel": true
      },
      "theme": "frontier-fantasy",
      "summary": "Ashlands frontier; one town, wilderness to the east, outskirts where the great dungeon mouth opens.",
      "regionId": "emberfall",
      "districts": [
        {
          "name": "Market District",
          "exits": [
            {
              "label": "Temple District",
              "targetPlaceId": "emberfall-temple"
            },
            {
              "label": "Gate",
              "targetPlaceId": "emberfall-outskirts-gate"
            }
          ],
          "placeId": "emberfall-market",
          "description": "Traders, inn, rune forge."
        },
        {
          "name": "Temple District",
          "exits": [
            {
              "label": "Market",
              "targetPlaceId": "emberfall-market"
            },
            {
              "label": "Keep",
              "targetPlaceId": "emberfall-keep"
            }
          ],
          "placeId": "emberfall-temple",
          "description": "Shrines and healers."
        },
        {
          "name": "Keep District",
          "exits": [
            {
              "label": "Temple District",
              "targetPlaceId": "emberfall-temple"
            }
          ],
          "placeId": "emberfall-keep",
          "description": "Garrison and lord's hall."
        }
      ],
      "outskirts": [
        {
          "name": "Outskirts (Gate)",
          "exits": [
            {
              "label": "Market",
              "targetPlaceId": "emberfall-market"
            },
            {
              "label": "Eastern Wilds",
              "targetPlaceId": "emberfall-wild-east"
            }
          ],
          "placeId": "emberfall-outskirts-gate",
          "description": "Road from town to the wild."
        },
        {
          "name": "Outskirts (North)",
          "exits": [
            {
              "label": "Northern Cinder",
              "targetPlaceId": "emberfall-wild-north"
            }
          ],
          "placeId": "emberfall-outskirts-north",
          "description": "Northern road."
        }
      ],
      "structure": {
        "townCount": 1,
        "districtCount": 3,
        "outskirtsZoneCount": 2,
        "wildernessZoneCount": 2,
        "dungeonEntranceCount": 1
      },
      "wilderness": [
        {
          "name": "Eastern Wilds",
          "exits": [
            {
              "label": "Outskirts",
              "targetPlaceId": "emberfall-outskirts-gate"
            },
            {
              "label": "Dungeon mouth",
              "targetPlaceId": "emberfall-dungeon-mouth"
            }
          ],
          "placeId": "emberfall-wild-east",
          "description": "Unpatrolled hills; beasts and bandits."
        },
        {
          "name": "Northern Cinder",
          "exits": [
            {
              "label": "Outskirts",
              "targetPlaceId": "emberfall-outskirts-north"
            }
          ],
          "placeId": "emberfall-wild-north",
          "description": "Volcanic foothills."
        }
      ],
      "visualHints": {
        "biome": "ashlands",
        "tileset": "region-surface",
        "unrealFolder": "/Game/DungeonBreak/Levels/Regions/Emberfall"
      },
      "dungeonEntrances": [
        {
          "name": "Dungeon mouth",
          "exits": [
            {
              "label": "Eastern Wilds",
              "targetPlaceId": "emberfall-wild-east"
            },
            {
              "label": "Enter Dungeon",
              "targetRegionId": "dungeon-floors"
            }
          ],
          "inZone": "wilderness",
          "placeId": "emberfall-dungeon-mouth",
          "description": "The great pit. Enter the dungeon."
        }
      ],
      "connectionRegionIds": [
        "transition-escape-threshold",
        "frostmere",
        "ashford"
      ]
    },
    {
      "kind": "hub",
      "name": "Frostmere",
      "tags": [
        "surface",
        "frost",
        "north"
      ],
      "town": {
        "name": "Frostmere Town",
        "exits": [],
        "placeId": "frostmere-town",
        "description": "Last stop before the ice wastes."
      },
      "rules": {
        "usesRooms": false,
        "isSafeZone": false,
        "usesBuildings": true,
        "supportsFastTravel": true
      },
      "theme": "frost-frontier",
      "summary": "Cold northern region; town on the ice-road, wilderness and outskirts with a sunken dungeon.",
      "regionId": "frostmere",
      "districts": [
        {
          "name": "Harbor District",
          "exits": [
            {
              "label": "Longhouse",
              "targetPlaceId": "frostmere-longhouse"
            }
          ],
          "placeId": "frostmere-harbor",
          "description": "Docks and trade."
        },
        {
          "name": "Longhouse District",
          "exits": [
            {
              "label": "Harbor",
              "targetPlaceId": "frostmere-harbor"
            },
            {
              "label": "Outskirts",
              "targetPlaceId": "frostmere-outskirts"
            }
          ],
          "placeId": "frostmere-longhouse",
          "description": "Hall and forges."
        }
      ],
      "outskirts": [
        {
          "name": "Outskirts",
          "exits": [
            {
              "label": "Longhouse",
              "targetPlaceId": "frostmere-longhouse"
            },
            {
              "label": "Ice Wastes",
              "targetPlaceId": "frostmere-wild-ice"
            }
          ],
          "placeId": "frostmere-outskirts",
          "description": "Edge of the ice-road."
        }
      ],
      "structure": {
        "townCount": 1,
        "districtCount": 2,
        "outskirtsZoneCount": 1,
        "wildernessZoneCount": 2,
        "dungeonEntranceCount": 1
      },
      "wilderness": [
        {
          "name": "Ice Wastes",
          "exits": [
            {
              "label": "Outskirts",
              "targetPlaceId": "frostmere-outskirts"
            },
            {
              "label": "Sinkhole",
              "targetPlaceId": "frostmere-dungeon-entrance"
            }
          ],
          "placeId": "frostmere-wild-ice",
          "description": "Frozen expanse."
        },
        {
          "name": "Frost Caves",
          "exits": [
            {
              "label": "Outskirts",
              "targetPlaceId": "frostmere-outskirts"
            }
          ],
          "placeId": "frostmere-wild-caves",
          "description": "Caves and crevices."
        }
      ],
      "visualHints": {
        "biome": "frost",
        "tileset": "region-surface",
        "unrealFolder": "/Game/DungeonBreak/Levels/Regions/Frostmere"
      },
      "dungeonEntrances": [
        {
          "name": "Sinkhole",
          "exits": [
            {
              "label": "Ice Wastes",
              "targetPlaceId": "frostmere-wild-ice"
            },
            {
              "label": "Enter Dungeon",
              "targetRegionId": "dungeon-floors"
            }
          ],
          "inZone": "wilderness",
          "placeId": "frostmere-dungeon-entrance",
          "description": "Dungeon entrance in the wastes."
        }
      ],
      "connectionRegionIds": [
        "emberfall",
        "verdant-hollow"
      ]
    },
    {
      "kind": "hub",
      "name": "Ashford",
      "tags": [
        "surface",
        "ashlands",
        "river"
      ],
      "town": {
        "name": "Ashford Town",
        "exits": [],
        "placeId": "ashford-town",
        "description": "River crossing and trade post."
      },
      "rules": {
        "usesRooms": false,
        "isSafeZone": false,
        "usesBuildings": true,
        "supportsFastTravel": true
      },
      "theme": "frontier-fantasy",
      "summary": "Burned lands; town clings to the river, wilderness and outskirts hold old ruins and a dungeon crack.",
      "regionId": "ashford",
      "districts": [
        {
          "name": "River District",
          "exits": [
            {
              "label": "Ember Quarter",
              "targetPlaceId": "ashford-ember"
            }
          ],
          "placeId": "ashford-river",
          "description": "Docks and mills."
        },
        {
          "name": "Ember Quarter",
          "exits": [
            {
              "label": "River",
              "targetPlaceId": "ashford-river"
            },
            {
              "label": "Outskirts",
              "targetPlaceId": "ashford-outskirts-south"
            }
          ],
          "placeId": "ashford-ember",
          "description": "Smithies and barracks."
        }
      ],
      "outskirts": [
        {
          "name": "South Outskirts",
          "exits": [
            {
              "label": "Ember Quarter",
              "targetPlaceId": "ashford-ember"
            }
          ],
          "placeId": "ashford-outskirts-south",
          "description": "Road south."
        },
        {
          "name": "North Outskirts",
          "exits": [
            {
              "label": "Old Ruins",
              "targetPlaceId": "ashford-ruins"
            }
          ],
          "placeId": "ashford-outskirts-north",
          "description": "Road to ruins."
        }
      ],
      "structure": {
        "townCount": 1,
        "districtCount": 2,